{
  "$schema": "../schemas/vector-index.schema.json",
  "$comment": "Generated by node contract/tools/generate.mjs. Edit contract/tools, not these files.",
  "contract": 3,
  "loading": "Read this file first. Paths are relative to contract/. Run every group that lists you as a consumer, with exactly one adapter per group, and fail if a file is missing or if you ran a different number of cases than consumers.<you> says.",
  "comparison": "Objects by key set in any order; arrays element by element; strings by code point; booleans and null by identity; numbers in expect are integers. Every expect key is present. A field named *Text is a JSON document: compare parsed, object key order ignored, number lexemes exact.",
  "families": [
    {
      "family": "hash",
      "file": "hash-vectors.json",
      "schema": "hash-vectors.schema.json",
      "layout": "flat",
      "section": "12",
      "reference": "tools/canonical.mjs",
      "generator": "tools/make-hash-vectors.mjs",
      "groups": [
        {
          "group": "vectors",
          "cases": 22,
          "consumers": {
            "agent": 22,
            "mac": 22,
            "desktop": 22,
            "android": 22
          }
        }
      ]
    },
    {
      "family": "identifiers",
      "file": "vectors/identifiers.json",
      "schema": "identifiers-vectors.schema.json",
      "layout": "groups",
      "section": "1",
      "reference": "tools/identifiers.mjs",
      "generator": "tools/vectors/identifiers.cases.mjs",
      "groups": [
        {
          "group": "token",
          "cases": 15,
          "consumers": {
            "agent": 15,
            "mac": 15,
            "desktop": 15,
            "android": 15
          }
        },
        {
          "group": "configuredId",
          "cases": 10,
          "consumers": {
            "agent": 10,
            "mac": 10,
            "desktop": 10,
            "android": 10
          }
        },
        {
          "group": "setupId",
          "cases": 11,
          "consumers": {
            "agent": 11,
            "mac": 11,
            "desktop": 11,
            "android": 11
          }
        },
        {
          "group": "opId",
          "cases": 9,
          "consumers": {
            "agent": 9,
            "mac": 9,
            "desktop": 9,
            "android": 9
          }
        },
        {
          "group": "duration",
          "cases": 12,
          "consumers": {
            "agent": 12,
            "mac": 12,
            "desktop": 12,
            "android": 12
          }
        },
        {
          "group": "clockTime",
          "cases": 9,
          "consumers": {
            "agent": 9,
            "mac": 9,
            "desktop": 9,
            "android": 9
          }
        },
        {
          "group": "sha256",
          "cases": 7,
          "consumers": {
            "agent": 7,
            "mac": 7,
            "desktop": 7,
            "android": 7
          }
        }
      ]
    },
    {
      "family": "outcome",
      "file": "vectors/outcome.json",
      "schema": "outcome-vectors.schema.json",
      "layout": "groups",
      "section": "5.6",
      "reference": "tools/outcome.mjs",
      "generator": "tools/vectors/outcome.cases.mjs",
      "groups": [
        {
          "group": "reduce",
          "cases": 59,
          "consumers": {
            "agent": 59,
            "mac": 59,
            "desktop": 59,
            "android": 59
          }
        },
        {
          "group": "records",
          "cases": 12,
          "consumers": {
            "mac": 12,
            "desktop": 12,
            "android": 12
          }
        }
      ]
    },
    {
      "family": "transport",
      "file": "vectors/transport.json",
      "schema": "transport-vectors.schema.json",
      "layout": "groups",
      "section": "15",
      "reference": "tools/transport.mjs",
      "generator": "tools/vectors/transport.cases.mjs",
      "groups": [
        {
          "group": "grammars",
          "cases": 17,
          "consumers": {
            "agent": 17,
            "mac": 17,
            "desktop": 17,
            "android": 17
          }
        },
        {
          "group": "commandLines",
          "cases": 51,
          "consumers": {
            "agent": 8,
            "mac": 51,
            "desktop": 51,
            "android": 51
          }
        },
        {
          "group": "classifications",
          "cases": 63,
          "consumers": {
            "mac": 63,
            "desktop": 63,
            "android": 23
          }
        },
        {
          "group": "walks",
          "cases": 12,
          "consumers": {
            "mac": 12,
            "desktop": 12,
            "android": 12
          }
        },
        {
          "group": "statusBudgets",
          "cases": 8,
          "consumers": {
            "mac": 8,
            "desktop": 8,
            "android": 8
          }
        },
        {
          "group": "hosts",
          "cases": 34,
          "consumers": {
            "agent": 34,
            "mac": 34,
            "desktop": 34,
            "android": 34
          }
        },
        {
          "group": "users",
          "cases": 20,
          "consumers": {
            "agent": 20,
            "mac": 20,
            "desktop": 20,
            "android": 20
          }
        },
        {
          "group": "ports",
          "cases": 8,
          "consumers": {
            "agent": 8,
            "mac": 8,
            "desktop": 8,
            "android": 8
          }
        }
      ]
    },
    {
      "family": "setup-acceptance",
      "file": "vectors/setup-acceptance.json",
      "schema": "setup-acceptance-vectors.schema.json",
      "layout": "groups",
      "section": "9.7",
      "reference": "tools/document-rules.mjs",
      "generator": "tools/vectors/setup-acceptance.cases.mjs",
      "groups": [
        {
          "group": "documents",
          "cases": 82,
          "consumers": {
            "agent": 72,
            "mac": 82,
            "desktop": 82,
            "android": 82
          }
        }
      ]
    },
    {
      "family": "launch",
      "file": "vectors/launch.json",
      "schema": "launch-vectors.schema.json",
      "layout": "groups",
      "section": "9.9",
      "reference": "tools/launch.mjs",
      "generator": "tools/vectors/launch.cases.mjs",
      "groups": [
        {
          "group": "review",
          "cases": 38,
          "consumers": {
            "agent": 38,
            "mac": 38,
            "desktop": 38,
            "android": 38
          }
        },
        {
          "group": "migration",
          "cases": 12,
          "consumers": {
            "agent": 12,
            "mac": 12,
            "desktop": 12,
            "android": 12
          }
        }
      ]
    },
    {
      "family": "setup-reconcile",
      "file": "vectors/setup-reconcile.json",
      "schema": "setup-reconcile-vectors.schema.json",
      "layout": "groups",
      "section": "9.5",
      "reference": "tools/setup-sync.mjs",
      "generator": "tools/vectors/setup-reconcile.cases.mjs",
      "groups": [
        {
          "group": "decide",
          "cases": 17,
          "consumers": {
            "mac": 17,
            "desktop": 17,
            "android": 17
          }
        },
        {
          "group": "admit",
          "cases": 7,
          "consumers": {
            "mac": 7,
            "desktop": 7,
            "android": 7
          }
        },
        {
          "group": "gate",
          "cases": 20,
          "consumers": {
            "mac": 20,
            "desktop": 20,
            "android": 20
          }
        },
        {
          "group": "pushReply",
          "cases": 14,
          "consumers": {
            "mac": 14,
            "desktop": 14,
            "android": 14
          }
        }
      ]
    },
    {
      "family": "setup-merge",
      "file": "vectors/setup-merge.json",
      "schema": "setup-merge-vectors.schema.json",
      "layout": "groups",
      "section": "9.8",
      "reference": "tools/setup-sync.mjs",
      "generator": "tools/vectors/setup-merge.cases.mjs",
      "groups": [
        {
          "group": "merges",
          "cases": 29,
          "consumers": {
            "mac": 29,
            "desktop": 29,
            "android": 29
          }
        },
        {
          "group": "bases",
          "cases": 5,
          "consumers": {
            "mac": 5,
            "desktop": 5,
            "android": 5
          }
        },
        {
          "group": "numbers",
          "cases": 10,
          "consumers": {
            "mac": 10,
            "desktop": 10,
            "android": 10
          }
        }
      ]
    },
    {
      "family": "wake",
      "file": "vectors/wake.json",
      "schema": "wake-vectors.schema.json",
      "layout": "groups",
      "section": "10",
      "reference": "tools/wake-plan.mjs",
      "generator": "tools/vectors/wake.cases.mjs",
      "groups": [
        {
          "group": "prefixes",
          "cases": 19,
          "consumers": {
            "mac": 19,
            "desktop": 19,
            "android": 19
          }
        },
        {
          "group": "broadcasts",
          "cases": 8,
          "consumers": {
            "mac": 8,
            "desktop": 8,
            "android": 8
          }
        },
        {
          "group": "plans",
          "cases": 22,
          "consumers": {
            "mac": 22,
            "desktop": 22,
            "android": 22
          }
        },
        {
          "group": "readiness",
          "cases": 2,
          "consumers": {
            "mac": 2,
            "desktop": 2,
            "android": 2
          }
        }
      ]
    }
  ]
}
